{
  "$schema": "http://json-schema.org/draft-07/schema#",
  "title": "CodexDepot Item Frontmatter",
  "type": "object",
  "additionalProperties": false,
  "properties": {
    "id": {
      "type": "string",
      "pattern": "^(skill|agent|command|template|hook|setting)\\.[a-z0-9]+(?:-[a-z0-9]+)*$"
    },
    "type": {
      "type": "string",
      "enum": ["skill", "agent", "command", "template", "hook", "setting"]
    },
    "title": {
      "type": "string",
      "minLength": 3,
      "maxLength": 120
    },
    "summary": {
      "type": "string",
      "minLength": 10,
      "maxLength": 240
    },
    "tags": {
      "type": "array",
      "minItems": 3,
      "maxItems": 8,
      "uniqueItems": true,
      "items": {
        "type": "string",
        "pattern": "^[a-z0-9][a-z0-9-]{1,31}$"
      }
    },
    "author": {
      "type": "string",
      "minLength": 2,
      "maxLength": 80
    },
    "license": {
      "type": "string",
      "pattern": "^[A-Za-z0-9.+-]+$"
    },
    "compatibility": {
      "type": "array",
      "minItems": 1,
      "maxItems": 8,
      "uniqueItems": true,
      "items": {
        "type": "string",
        "minLength": 2,
        "maxLength": 40
      }
    },
    "updated_at": {
      "type": "string",
      "pattern": "^\\d{4}-\\d{2}-\\d{2}$"
    },
    "created_at": {
      "type": "string",
      "pattern": "^\\d{4}-\\d{2}-\\d{2}$"
    },
    "difficulty": {
      "type": "string",
      "enum": ["beginner", "intermediate", "advanced"]
    },
    "safety_notes": {
      "type": "string",
      "minLength": 5,
      "maxLength": 500
    },
    "source_url": {
      "type": "string",
      "pattern": "^https?://.+$"
    },
    "trigger": {
      "type": "string",
      "minLength": 2,
      "maxLength": 80
    },
    "runtime": {
      "type": "string",
      "minLength": 2,
      "maxLength": 40
    },
    "permissions": {
      "type": "array",
      "minItems": 1,
      "maxItems": 20,
      "uniqueItems": true,
      "items": {
        "type": "string",
        "minLength": 2,
        "maxLength": 80
      }
    },
    "target_tool": {
      "type": "string",
      "minLength": 2,
      "maxLength": 80
    },
    "schema_version": {
      "type": "string",
      "pattern": "^\\d+\\.\\d+\\.\\d+$"
    }
  },
  "required": [
    "id",
    "type",
    "title",
    "summary",
    "tags",
    "author",
    "license",
    "compatibility",
    "updated_at"
  ]
}
